<?xml version="1.0"?>
<?xml-stylesheet type="text/xsl" href="yaxx.xsl"?><!DOCTYPE sql_list SYSTEM "sql2.dtd">
<yaxx:sql_list xmlns:yaxx="urn:YAcc-Xml-eXtension">
<yaxx:sql>
<yaxx:manipulative_statement>
<yaxx:select_statement>
<yaxx:SELECT>SELECT</yaxx:SELECT>
<yaxx:opt_all_distinct>
<yaxx:DISTINCT>DISTINCT</yaxx:DISTINCT>
</yaxx:opt_all_distinct>
<yaxx:selection>
<yaxx:scalar_exp_commalist>
<yaxx:scalar_exp>
<yaxx:column_ref>
<yaxx:NAME>key</yaxx:NAME>
</yaxx:column_ref>
</yaxx:scalar_exp>
</yaxx:scalar_exp_commalist>
</yaxx:selection>
<yaxx:INTO>INTO</yaxx:INTO>
<yaxx:target_commalist>
<yaxx:target>
<yaxx:parameter_ref>
<yaxx:parameter>
<yaxx:PARAMETER>:name</yaxx:PARAMETER>
</yaxx:parameter>
</yaxx:parameter_ref>
</yaxx:target>
</yaxx:target_commalist>
<yaxx:table_exp>
<yaxx:from_clause>
<yaxx:FROM>FROM</yaxx:FROM>
<yaxx:table_ref_commalist>
<yaxx:table_ref>
<yaxx:table>
<yaxx:NAME>student</yaxx:NAME>
</yaxx:table>
</yaxx:table_ref>
</yaxx:table_ref_commalist>
</yaxx:from_clause>
<yaxx:opt_where_clause>
</yaxx:opt_where_clause>
<yaxx:opt_group_by_clause>
</yaxx:opt_group_by_clause>
<yaxx:opt_having_clause>
</yaxx:opt_having_clause>
</yaxx:table_exp>
</yaxx:select_statement>
</yaxx:manipulative_statement>
</yaxx:sql>
<yaxx:CHAR59>;</yaxx:CHAR59>
</yaxx:sql_list>

